{
  "paths": {
    "rules": "/ru les/",
    "compendium": "/compend ium/"
  },
  "sources": {
    "adventure": [
      "WBtW",
      "MOT-NSS",
      "DIP",
      ""
    ],
    "book": [
      "PHB",
      "MOT",
      ""
    ],
    "reference": [
      "DMG",
      "XGE",
      "TCE",
      ""
    ],
    "homebrew": [
      ""
    ]
  },
  "include": [
    "race|changeling|mpmm"
  ],
  "exclude": [
    "monster|expert|dc",
    "monster|expert|sdw",
    "monster|expert|slw"
  ],
  "excludePattern": [
    "race\\|.*\\|dmg"
  ]
}
